{
  "$schema": "https://json-schema.org/draft/2020-12/schema",
  "additionalProperties": false,
  "properties": {
    "apparmor_profile_sha256": {
      "pattern": "^[0-9a-f]{64}$",
      "type": "string"
    },
    "artifact_paths": {
      "additionalProperties": false,
      "properties": {
        "redacted_report": {
          "type": "string"
        },
        "redaction_audit": {
          "type": "string"
        }
      },
      "required": [
        "redacted_report",
        "redaction_audit"
      ],
      "type": "object"
    },
    "attack_scenarios_sha256": {
      "pattern": "^[0-9a-f]{64}$",
      "type": "string"
    },
    "audit_plan_sha256": {
      "pattern": "^[0-9a-f]{64}$",
      "type": "string"
    },
    "example_only": {
      "type": "boolean"
    },
    "finding_summary_redacted": {
      "type": "string"
    },
    "hardening_manifest_sha256": {
      "pattern": "^[0-9a-f]{64}$",
      "type": "string"
    },
    "redaction_reviewed": {
      "type": "boolean"
    },
    "reviewed_scenario_id": {
      "type": "string"
    },
    "reviewer_type": {
      "enum": [
        "example",
        "third_party_pentester"
      ],
      "type": "string"
    },
    "run_id": {
      "pattern": "^[a-z0-9][a-z0-9._-]{2,63}$",
      "type": "string"
    },
    "source_story": {
      "const": "M3.7",
      "type": "string"
    },
    "supply_chain_policy_sha256": {
      "pattern": "^[0-9a-f]{64}$",
      "type": "string"
    }
  },
  "required": [
    "source_story",
    "example_only",
    "run_id",
    "reviewer_type",
    "reviewed_scenario_id",
    "audit_plan_sha256",
    "attack_scenarios_sha256",
    "supply_chain_policy_sha256",
    "hardening_manifest_sha256",
    "apparmor_profile_sha256",
    "redaction_reviewed",
    "artifact_paths",
    "finding_summary_redacted"
  ],
  "title": "M3.7 sandbox security pentest evidence",
  "type": "object"
}
