{
  "apparmor_profile_sha256": "633480f0068a87628d8648132bc0d715340a92f07d1607bfd1211960c7c80f09",
  "artifact_paths": {
    "redacted_report": "reports/sandbox-security/example-sandbox-audit-20260526/redacted-report.pdf",
    "redaction_audit": "reports/sandbox-security/example-sandbox-audit-20260526/redaction-audit.json"
  },
  "attack_scenarios_sha256": "ab6b443ef63d6e6b510991400ce86dc142e3244dbc3ff4e787ad7cb521e29b90",
  "audit_plan_sha256": "48239539617b6c882db9558dee5465ac90f7f9e395b4ce52b41c35a8c42e0989",
  "example_only": true,
  "finding_summary_redacted": "Synthetic example only; no real pentest finding.",
  "hardening_manifest_sha256": "231b6c16facab046ce1703f414930a28e02d939159d5047a81d6afbc31e803b5",
  "redaction_reviewed": false,
  "reviewed_scenario_id": "escape-fork-bomb",
  "reviewer_type": "example",
  "run_id": "example-sandbox-audit-20260526",
  "source_story": "M3.7",
  "supply_chain_policy_sha256": "e096ea9a05866b90380f86b9d2eec14a29848b7d65aa8b02e9534b8da41b513f"
}
